reference,title,date,description,thumbnail,full_listing,latitude,longitude,subject_type,province,additional_url,location_check,location_notes,image_notes
BL/CV/TP/Tipperary/5,"Roscrea Tower & Castle, Tipperary",[1830],"Image of the the round tower and castle, and surrounding town, in Roscrea, County Tipperary. In the foreground, a man with a fishing rod leans against a wall looking out over the river. Another figure can be seen standing on the river bank across from the tower.",,,52.955879,-7.795962,,Munster,,,,
BL/CV/TP/Tipperary/6,Antiquities in Ireland [A Tumulus near Tipperary],September 1778,"Image of four objects numbered and identified, including a tumulus near Tipperary.",,,,,,Munster,,,,
BL/CV/TP/Tipperary/7,"Police Barrack at Aheny-Hill, Burnt by the Insurgents",23 September 1848,"Image of the remains of the police barracks at Aheny Hill in County Tipperary, having being burnt.",,,52.430455,-7.402421,,Munster,,,,
BL/CV/TP/Waterford/1,The Valley of the Blackwater,[1841-3],Elevated view of the Blackwater River in the Blackwater Valley. The view includes Strancally castle and sailing ships on the river. Mountains are visible in the distance. In the lower foreground two people survey the scene from a hillside.,,,52.068649,-7.875522,landscape,Munster,,,,
BL/CV/TP/Waterford/2,"Curaghmore, Co. Waterford",[1829],"Distant view of Curraghmore house and estate, the seat of the Marquess of Waterford. The view includes the house, estate and distant mountains. In the foreground people survey the scene from a hillside.",,,52.290264,-7.35937,,Munster,,,,
BL/CV/TP/Waterford/3,"Dunmore Pier, near Waterford",1831,"View of Dunmore Pier with the lighthouse, and sailing ships and rowing boats in the harbour.",,,52.147259,-6.991608,,Munster,,,,
BL/CV/TP/Waterford/4,"Views from the Castle of Lismore, Co. Waterford",March 1794,Two images of the Castle of Lismore. Fig. 1 is of the riding-house and is the entrance to a long avenue which leads to Fig. 2 the entrance to the great square of the castle.,,,52.140572,-7.932187,,Munster,,,,
BL/CV/TP/Waterford/5,"Lismore Castle, Co. Waterford",[1831],View of Lismore Castle from the Blackwater River. The castle emerges from the trees on the high ground of the bank. A steeple is visible on the left-hand side. The bridge over the river occupies and centre of the image. In the foreground a man fishes in the river.,,,52.141665,-7.930502,,Munster,,,,
BL/CV/TP/Waterford/6,Waterford,1 May 1779,"Distant view of the town of Waterford and surrounding area. There are a number of sailing vessels on the river [Suir] on the right-hand side of the image. In the foreground, on the left-hand side, a number of travellers make there way along the road towards the town. Distant hills can be seen beyond the town across the river.",,,,,townscape,Munster,,,,
BL/CV/TP/Waterford/7,The Quay at Waterford,[1841-3],"View of the quay in Waterford. Reginald's tower and other buildings line the quay on the left-hand side of the image. The quay is busy with various people and a horse and cart. Boats and a ship are moored along the river on the right-hand side of the image. In the foreground, a soldier sits on bales next to two casks at the edge of the quay. A woman stands next to him and his rifle and a jug are on the ground nearby.",,,52.260419,-7.104594,,Munster,,,,
BL/CV/TP/Waterford/8,"The Quay, Waterford",[1842],"View of the quay in Wateford, with Reginald's tower prominent on the left-hand side of the image. The quay is busy with various people, animals and carts. A steam ship and sailing ship are moored along the river on the right-hand side with a number of other vessels visible on the water.",,,,,,Munster,,,,
BL/CV/TP/Waterford/9,Waterford,[1841-3],"View of Waterford from across the river. The bridge over the river occupies the centre of the image with the town on the right-hand side. A number of sailing vessels are visible on the river. In the foreground, a single man sits surveying the scene. Below, a number of people and a horse and carriage pass along the shoreline. ",,,,,,Munster,,,,
BL/CV/TP/Waterford/10,Carrick Beg / Carrick-ne-Sure,1 February 1779,"View of the Waterford side of Carrickbeg, part of present day Carrick-on-Suir. The view includes the old bridge over the River Suir. The ruins of St. Molleran's church are located on the opposite bank of the river with hills in the background. A boat rows past on the right-hand side. A group of people are on the shore in the foreground.",,,52.345472,-7.414948,,Munster,,,,
BL/CV/TP/Waterford/11,St. Kelly's Castle on the Black Water,1 July 1779,"View of the ruin of St. Kelly's Castle on the bank of the Blackwater river. There are two sail boats in the foreground, and a third in the background. The image is in an oval frame, with the title in a banner at the top. At the bottom of the frame are two cornucopias with fish and flowers. Mother and Child with St John the Baptist are seated on the left cornucopia.",,,,,,Munster,,,,
